{
  "block_reason": null,
  "components": [
    {
      "bytes": 33588,
      "component_id": "effective-provider-request",
      "items": 1,
      "kind": "objective_task",
      "reducible": false,
      "retention_rank": 5,
      "sha256": "d22f562dfe3472e8e3002118c4b2fb50672991f1aa8e3ccce9c4a08a8f77745a"
    }
  ],
  "deterministic_reduction_only": true,
  "hard_cap_bytes": 262144,
  "hard_cap_items": null,
  "manifest_digest": "e77057df9bf852dbf97096532f783683c1efe86488a0d8fffa1810225d3656ce",
  "manifest_id": "phase-PROOF4-P01-a1-proof",
  "measured_at": "2026-08-10T08:52:45Z",
  "measured_component_kinds": [
    "objective_task"
  ],
  "provider_internal_prompt_overhead": "UNAVAILABLE",
  "provider_internal_transforms": "UNAVAILABLE",
  "provider_native_token_counts": "UNAVAILABLE",
  "reductions": [],
  "role_id": "implementation",
  "run_id": "qualified-proof-claude-r4",
  "schema_version": "1.0",
  "semantic_compression_used": false,
  "serialized_request_bytes": 34568,
  "serialized_request_sha256": "96033d69c11eb9e7e8fd0948c4018b202f96b9d0c6225f6a40c8fc715f68ba23",
  "status": "WITHIN_CAP",
  "task_id": "PROOF4-P01",
  "token_estimation_method": "none; host measures bytes and items only",
  "total_items": 1,
  "unmeasured_component_kinds": [
    "adapter_wrapper",
    "attachment_excerpts",
    "durable_state_summary",
    "profile_text",
    "selected_history",
    "system_control_text",
    "tool_results",
    "tool_schemas"
  ]
}
