{
  "block_reason": null,
  "components": [
    {
      "bytes": 32749,
      "component_id": "effective-provider-request",
      "items": 1,
      "kind": "objective_task",
      "reducible": false,
      "retention_rank": 5,
      "sha256": "4f923ab53f5764b06348ed66b5be2dd1054236c78e7890bfed959d6941fe1394"
    }
  ],
  "deterministic_reduction_only": true,
  "hard_cap_bytes": 262144,
  "hard_cap_items": null,
  "manifest_digest": "b4c3e0cffa6bd14febb3c207ecdc5500c72ac37c1a67247bd2f848c6d73e504b",
  "manifest_id": "phase-PROOF-P01-a1-proof",
  "measured_at": "2026-08-10T05:42:03Z",
  "measured_component_kinds": [
    "objective_task"
  ],
  "provider_internal_prompt_overhead": "UNAVAILABLE",
  "provider_internal_transforms": "UNAVAILABLE",
  "provider_native_token_counts": "UNAVAILABLE",
  "reductions": [],
  "role_id": "implementation",
  "run_id": "canonical-proof-codex",
  "schema_version": "1.0",
  "semantic_compression_used": false,
  "serialized_request_bytes": 33727,
  "serialized_request_sha256": "2202cbedc2a1163ab42096bd43f64d330525ddb64bb8e74e8bcc63b140a89540",
  "status": "WITHIN_CAP",
  "task_id": "PROOF-P01",
  "token_estimation_method": "none; host measures bytes and items only",
  "total_items": 1,
  "unmeasured_component_kinds": [
    "adapter_wrapper",
    "attachment_excerpts",
    "durable_state_summary",
    "profile_text",
    "selected_history",
    "system_control_text",
    "tool_results",
    "tool_schemas"
  ]
}
