{
  "block_reason": null,
  "components": [
    {
      "bytes": 32755,
      "component_id": "effective-provider-request",
      "items": 1,
      "kind": "objective_task",
      "reducible": false,
      "retention_rank": 5,
      "sha256": "7dee27cb06e1305cc4bc71f3b789fd02c51b259c2e2796bdcf3c5f48a650b2b1"
    }
  ],
  "deterministic_reduction_only": true,
  "hard_cap_bytes": 262144,
  "hard_cap_items": null,
  "manifest_digest": "8cfbf439493bdc0cc6e6d54c69e11f279d7ced2341fbc580629037e6d710ae50",
  "manifest_id": "phase-PROOF-P01-a1-proof",
  "measured_at": "2026-08-10T05:41:47Z",
  "measured_component_kinds": [
    "objective_task"
  ],
  "provider_internal_prompt_overhead": "UNAVAILABLE",
  "provider_internal_transforms": "UNAVAILABLE",
  "provider_native_token_counts": "UNAVAILABLE",
  "reductions": [],
  "role_id": "implementation",
  "run_id": "canonical-proof-claude",
  "schema_version": "1.0",
  "semantic_compression_used": false,
  "serialized_request_bytes": 33733,
  "serialized_request_sha256": "53764ab5d9dff2bd143925a9ab627dc14cf663f3558a1daef52be779b1989450",
  "status": "WITHIN_CAP",
  "task_id": "PROOF-P01",
  "token_estimation_method": "none; host measures bytes and items only",
  "total_items": 1,
  "unmeasured_component_kinds": [
    "adapter_wrapper",
    "attachment_excerpts",
    "durable_state_summary",
    "profile_text",
    "selected_history",
    "system_control_text",
    "tool_results",
    "tool_schemas"
  ]
}
